{
  "$schema": "https://ievangelist.github.io/api.contracts/schemas/api-schema.json",
  "schemaVersion": "1.0.0",
  "package": {
    "name": "SampleApi",
    "version": "1.0.0.0",
    "targetFramework": "net10.0"
  },
  "apiHash": "sha256:9ab151e9b4dc3e41962fe2c32439aa388b1a5601a640f81d814b076f025d8c6c",
  "types": [
    {
      "name": "Address",
      "fullName": "SampleApi.Address",
      "namespace": "SampleApi",
      "kind": "record",
      "accessibility": "public",
      "interfaces": [
        "System.IEquatable<SampleApi.Address>"
      ],
      "docs": {
        "summary": "Represents a physical or mailing address, decomposed into street, city, state, postal code, and country components.",
        "remarks": "is a record class providing value-based equality and immutability by default, making it suitable for use as an embedded value object within aggregate roots such as . The  field uses ISO 3166-1 alpha-2 codes rather than full country names to ensure consistent, locale-independent storage.",
        "parameters": {
          "City": "The city or locality name (e.g., \"Seattle\").",
          "Country": "The ISO 3166-1 alpha-2 country code (e.g., \"US\", \"DE\").",
          "PostalCode": "The postal or ZIP code (e.g., \"98101\").",
          "State": "The state, province, or region (e.g., \"WA\").",
          "Street": "The street address, including house or building number (e.g., \"123 Main St\")."
        },
        "seeAlso": [
          "T:SampleApi.Customer"
        ]
      },
      "members": [
        {
          "name": ".ctor",
          "kind": "constructor",
          "accessibility": "public",
          "signature": "Address.Address(string Street, string City, string State, string PostalCode, string Country)",
          "returnType": "void",
          "parameters": [
            {
              "name": "Street",
              "type": "string"
            },
            {
              "name": "City",
              "type": "string"
            },
            {
              "name": "State",
              "type": "string"
            },
            {
              "name": "PostalCode",
              "type": "string"
            },
            {
              "name": "Country",
              "type": "string"
            }
          ],
          "docs": {
            "summary": "Represents a physical or mailing address, decomposed into street, city, state, postal code, and country components.",
            "remarks": "is a record class providing value-based equality and immutability by default, making it suitable for use as an embedded value object within aggregate roots such as . The  field uses ISO 3166-1 alpha-2 codes rather than full country names to ensure consistent, locale-independent storage.",
            "parameters": {
              "City": "The city or locality name (e.g., \"Seattle\").",
              "Country": "The ISO 3166-1 alpha-2 country code (e.g., \"US\", \"DE\").",
              "PostalCode": "The postal or ZIP code (e.g., \"98101\").",
              "State": "The state, province, or region (e.g., \"WA\").",
              "Street": "The street address, including house or building number (e.g., \"123 Main St\")."
            },
            "seeAlso": [
              "T:SampleApi.Customer"
            ]
          }
        },
        {
          "name": "City",
          "kind": "property",
          "accessibility": "public",
          "signature": "string Address.City",
          "returnType": "string",
          "docs": {
            "summary": "The city or locality name (e.g., \"Seattle\")."
          }
        },
        {
          "name": "Country",
          "kind": "property",
          "accessibility": "public",
          "signature": "string Address.Country",
          "returnType": "string",
          "docs": {
            "summary": "The ISO 3166-1 alpha-2 country code (e.g., \"US\", \"DE\")."
          }
        },
        {
          "name": "PostalCode",
          "kind": "property",
          "accessibility": "public",
          "signature": "string Address.PostalCode",
          "returnType": "string",
          "docs": {
            "summary": "The postal or ZIP code (e.g., \"98101\")."
          }
        },
        {
          "name": "State",
          "kind": "property",
          "accessibility": "public",
          "signature": "string Address.State",
          "returnType": "string",
          "docs": {
            "summary": "The state, province, or region (e.g., \"WA\")."
          }
        },
        {
          "name": "Street",
          "kind": "property",
          "accessibility": "public",
          "signature": "string Address.Street",
          "returnType": "string",
          "docs": {
            "summary": "The street address, including house or building number (e.g., \"123 Main St\")."
          }
        }
      ]
    },
    {
      "name": "ApiEndpoints",
      "fullName": "SampleApi.ApiEndpoints",
      "namespace": "SampleApi",
      "kind": "class",
      "accessibility": "public",
      "isStatic": true,
      "docs": {
        "summary": "Provides well-known route path constants for the sample API.",
        "remarks": "Centralizing route paths in a static class ensures that controllers, clients, and tests reference the same values, reducing the risk of routing mismatches."
      },
      "members": [
        {
          "name": "CustomerById",
          "kind": "field",
          "accessibility": "public",
          "signature": "string ApiEndpoints.CustomerById",
          "returnType": "string",
          "isStatic": true,
          "docs": {
            "summary": "Route template for a single customer resource."
          }
        },
        {
          "name": "Customers",
          "kind": "field",
          "accessibility": "public",
          "signature": "string ApiEndpoints.Customers",
          "returnType": "string",
          "isStatic": true,
          "docs": {
            "summary": "Base path for customer endpoints."
          }
        },
        {
          "name": "Health",
          "kind": "field",
          "accessibility": "public",
          "signature": "string ApiEndpoints.Health",
          "returnType": "string",
          "isStatic": true,
          "docs": {
            "summary": "Path for the health-check endpoint."
          }
        },
        {
          "name": "OrderById",
          "kind": "field",
          "accessibility": "public",
          "signature": "string ApiEndpoints.OrderById",
          "returnType": "string",
          "isStatic": true,
          "docs": {
            "summary": "Route template for a single order resource."
          }
        },
        {
          "name": "Orders",
          "kind": "field",
          "accessibility": "public",
          "signature": "string ApiEndpoints.Orders",
          "returnType": "string",
          "isStatic": true,
          "docs": {
            "summary": "Base path for order endpoints."
          }
        },
        {
          "name": "ProductById",
          "kind": "field",
          "accessibility": "public",
          "signature": "string ApiEndpoints.ProductById",
          "returnType": "string",
          "isStatic": true,
          "docs": {
            "summary": "Route template for a single product resource."
          }
        },
        {
          "name": "Products",
          "kind": "field",
          "accessibility": "public",
          "signature": "string ApiEndpoints.Products",
          "returnType": "string",
          "isStatic": true,
          "docs": {
            "summary": "Path for the product catalogue."
          }
        },
        {
          "name": "Ready",
          "kind": "field",
          "accessibility": "public",
          "signature": "string ApiEndpoints.Ready",
          "returnType": "string",
          "isStatic": true,
          "docs": {
            "summary": "Path for the readiness probe endpoint."
          }
        }
      ]
    },
    {
      "name": "ApiResponse",
      "fullName": "SampleApi.ApiResponse<T>",
      "namespace": "SampleApi",
      "kind": "class",
      "accessibility": "public",
      "isGeneric": true,
      "genericParameters": [
        {
          "name": "T"
        }
      ],
      "docs": {
        "summary": "A generic envelope for API responses, providing a consistent wire format that wraps the data payload alongside success/failure status and metadata.",
        "remarks": "All API endpoints should return  to give clients a uniform structure for deserialization. The  flag allows clients to branch on success or failure without inspecting HTTP status codes, while  provides server-side timing for debugging and cache-invalidation purposes. For error responses,  will be  and will contain a human-readable error description. For richer error bodies, consider returning as the  payload.",
        "seeAlso": [
          "T:SampleApi.ProductDto",
          "T:SampleApi.ProblemDetails"
        ]
      },
      "members": [
        {
          "name": "Fail",
          "kind": "method",
          "accessibility": "public",
          "signature": "ApiResponse<T> ApiResponse<T>.Fail(string message)",
          "returnType": "SampleApi.ApiResponse<T>",
          "isStatic": true,
          "parameters": [
            {
              "name": "message",
              "type": "string"
            }
          ],
          "docs": {
            "summary": "Creates an error response with the specified message.",
            "returns": "A new  marked as unsuccessful.",
            "parameters": {
              "message": "The error message."
            }
          }
        },
        {
          "name": "Ok",
          "kind": "method",
          "accessibility": "public",
          "signature": "ApiResponse<T> ApiResponse<T>.Ok(T data, string? message = null)",
          "returnType": "SampleApi.ApiResponse<T>",
          "isStatic": true,